commit	fitness	noise	signal	bridge	phase	cluster	amp_div	links	status	description
b987a7c	0.545140	1.0000	0.0400	1.0000	0.0000	0.0000	0.0000	641	discard	L2 baseline: L1 params destroy signal in 3 cycles
3fcfdc1	0.137003	0.4000	0.8400	1.0000	0.8817	0.9707	1.0000	452	keep	L2-1: penalty=0.4 boost=0.3 coupling=0.8 steps=15 cycles=2
ebcf676	0.141982	0.8000	0.6000	1.0000	0.6948	0.9638	1.0000	498	discard	L2-2: interference=0.03 penalty=0.5 - signal dropped
f7d39fe	0.113076	0.9000	0.6267	1.0000	0.7506	0.9732	1.0000	502	keep	L2-5: phase=pi/2 penalty=0.5 - wider constructive band
68c4e95	0.098006	0.7000	0.8133	1.0000	0.8662	0.9692	1.0000	448	keep	L2-10: SINGLE CYCLE wins - less accumulation damage
93d7a6f	0.127953	0.7000	0.7733	1.0000	0.6992	0.9764	1.0000	450	discard	L2-11: interference=0.04 - lower threshold hurt signal0 2 c a 1 a f 	 0 . 1 3 4 7 0 6 	 0 . 7 0 0 0 	 0 . 8 1 3 3 	 1 . 0 0 0 0 	 0 . 6 1 6 5 	 0 . 9 7 5 0 	 1 . 0 0 0 0 	 4 4 8 	 d i s c a r d 	 L 2 - 3 5 :   c o u p l i n g = 0 . 6 5   -   t o o   w e a k  
 7 b 8 e e f 0 	 0 . 1 4 5 7 8 9 	 0 . 7 0 0 0 	 0 . 8 1 3 3 	 1 . 0 0 0 0 	 0 . 5 4 4 7 	 0 . 9 7 3 8 	 1 . 0 0 0 0 	 4 4 8 	 d i s c a r d 	 L 2 - 3 6 :   c o u p l i n g = 0 . 7 2   -   t o o   s t r o n g  
 5 9 5 a 8 a d 	 0 . 1 2 3 7 5 6 	 0 . 7 0 0 0 	 0 . 8 1 3 3 	 1 . 0 0 0 0 	 0 . 6 8 9 0 	 0 . 9 7 4 7 	 1 . 0 0 0 0 	 4 4 8 	 d i s c a r d 	 L 2 - 3 7 :   d e c a y = 8 e - 7   -   s m a l l   c h a n g e   h u r t  
 6 5 b d 2 c 8 	 0 . 1 2 9 0 0 7 	 0 . 7 0 0 0 	 0 . 8 1 3 3 	 1 . 0 0 0 0 	 0 . 6 4 9 2 	 0 . 9 7 9 3 	 1 . 0 0 0 0 	 4 4 8 	 d i s c a r d 	 L 2 - 3 8 :   t h r e s h o l d = 0 . 5   -   m o r e   s e l e c t i v e   b u t   w o r s e  
 3 3 0 b a f b 	 0 . 1 6 0 5 3 4 	 0 . 7 0 0 0 	 0 . 6 0 0 0 	 1 . 0 0 0 0 	 0 . 6 5 9 0 	 0 . 9 7 4 9 	 1 . 0 0 0 0 	 5 1 9 	 d i s c a r d 	 L 2 - 7 3 :   c o u p l i n g = 0 . 7 1   -   h u r t   m u l t i p l e   m e t r i c s  
 