cycle	fitness	noise	signal	bridge	phase	cluster	amp_div	xi_div	consciousness	hall_q	dream_eff	retention	plasticity	chain_fid	corpus_xi_div	enc_entropy	adv_resist	links	status	description
L4.S11-baseline	0.169076	1.0000	1.0000	1.0000	0.9616	0.9720	1.0000	1.0000	0.9871	1.0000	0.9818	1.0000	1.0000	0.9198	0.6188	1.0000	0.2945	5562	kept	L4.S11 STRUCTURAL metric reformulation: adversarial_resistance redefined from divergence (1 - |f_clean - f_adv|/(f_clean+0.05)) to absolute adv-score floor ((1 - f_adv_sub/0.15).clamp(0,1)). Rationale: old formula mechanically punished clean-only improvements by widening clean-vs-adv divergence, which structurally blocked per-pass tuning (L4.S9 post-mortem). New formula measures absolute adversarial robustness — production semantics. 15-run re-anchor baseline fitness 0.169076 std 0.012458 (all int_threshold=0.10, no other changes). adv_resistance 0.9571->0.2945 (as expected — old formula was inflating resistance near 1.0 via divergence=0). Deterministic metrics byte-identical to L4.S7 baseline (corpus_xi_div 0.6188, chain_fid 0.9198, phase_coh 0.9616, consciousness 0.9871, enc_entropy 1.0000). Cross-metric noise up (std 0.0005->0.012) because fitness now tracks adv_sub directly and adv pass has speed jitter. L3 spot-check: 0.006434 (archive band, change isolated to L4). CROSS-EPOCH WARNING: new-metric fitness 0.169 is NOT comparable to old-metric 0.096517 — different metric.
L4.S11c	0.182168	1.0000	1.0000	1.0000	0.9488	0.9710	1.0000	1.0000	0.9770	1.0000	0.9820	1.0000	1.0000	0.9891	0.8136	1.0000	0.1139	5474	reverted	L4.S11c: per-pass interference_threshold (clean=0.12, adv=0.10) under new absolute adv_resistance metric. 15-run fitness 0.169076->0.182168 (+0.01309, REGRESSION, fails 0.015 improvement threshold). Clean-pass deterministic wins fully realized (same as L4.S9): corpus_xi_diversity 0.6188->0.8136 (+0.195), chain_fidelity 0.9198->0.9891 (+0.069), fitness_clean_sub 0.0985->0.0936 (-0.005, smaller than expected 0.024 because runs were speed-contaminated). BUT adv_sub 0.1058->0.1329 (+0.027), driving resistance 0.2945->0.1139 (-0.18). Two factors: (a) adv pass was supposed to be unchanged at int=0.10, so the adv_sub rise is largely thermal/IO jitter across the session (baseline runs 1-7 speed~0.59, runs 8-15 speed~0.46; S11c runs speed 0.21-0.46); (b) the clean pass running 3x slower at int=0.12 causes CPU state bleed-through into the adv pass that follows it. Even if contamination is removed, the adv_sub at int=0.10 can not drop below ~0.106 (baseline level), so resistance contribution is at most 0.10 * (0.2945 - 0.1139) / ~2 ~ 0.009 — still below 0.015 threshold. Per-pass interference_threshold remains dead even under the new metric — the speed-coupling in fitness_adv_sub creates an indirect penalty similar to the old divergence formula. REVERTED. L3 spot-check: 0.006674 (archive band). Key insight: the absolute adv metric unblocks the FORMULA but not the FITNESS — speed is still shared across passes via adv_sub, so a slow clean pass still hurts adv_sub jitter. Future work: pin adv pass to a warm-up+multi-sample speed measurement, or reduce speed weight in fitness_adv_sub.
